white,black,white_elo,black_elo,result,opening,eco,site,time_control,termination
Wallerdos,chilico,1763,2010,0-1,?,?,https://lichess.org/npDpU5Pm,300+0,Abandoned
shadowtiger,BillDecant5,1677,1669,1-0,Sicilian Defense: Smith-Morra Gambit #2,B21,https://lichess.org/OWLzXHxG,300+0,Normal
communist23,adrielpavan,1959,1879,1-0,Sicilian Defense: Bowdler Attack,B20,https://lichess.org/1dEnOHWF,60+0,Normal
Bayron7,Toutatis,1764,1751,1-0,English Defense #2,A40,https://lichess.org/t9YpbMkr,60+0,Normal
Fabio77,fullmetall,1554,1599,0-1,Philidor Defense #3,C41,https://lichess.org/yPzk1caC,300+5,Normal
Nomel,Rikzz,1744,1730,0-1,Queen's Gambit Refused: Albin Countergambit,D08,https://lichess.org/FqY0zOFT,300+0,Normal
RickoCaro,italia-germania4-3,2013,1899,0-1,"Four Knights Game: Spanish Variation, Classical Variation",C48,https://lichess.org/y6EYTCqx,180+0,Time forfeit
cagtay,zeta16,1863,1746,1-0,Zukertort Opening: Tennison Gambit,A06,https://lichess.org/O4Y9LpCB,180+0,Time forfeit
ChuNNev,zapatilla,1620,1737,0-1,Queen's Pawn Game: Mason Attack,D00,https://lichess.org/USQEQ0TA,180+0,Normal
Kaipora,GeorgesHabitbol,1644,1540,1-0,Polish Opening: Dutch Defense,A00,https://lichess.org/PUwPuyr6,300+0,Normal
Supercerebraco,Zenone,1727,1727,1-0,Scandinavian Defense: Mieses-Kotroc Variation,B01,https://lichess.org/HDMFQL2I,300+0,Time forfeit
skf91,jcubas,1619,1548,1-0,"Queen's Gambit Refused: Baltic Defense, Pseudo-Slav",D02,https://lichess.org/Ye1yRUfo,60+0,Time forfeit
alekstone,jfinfantes,1572,1373,1-0,King's Pawn Game: Leonardis Variation,C20,https://lichess.org/0Ckyd42A,60+0,Time forfeit
gtrig,SlicedBrain,1940,1900,1/2-1/2,Hungarian Opening: Symmetrical Variation,A00,https://lichess.org/YukbvM7G,30+0,Normal
salvador333,dipo_a,1733,1575,0-1,Scandinavian Defense: Mieses-Kotroc Variation,B01,https://lichess.org/aqHXBdx5,360+0,Time forfeit
jvm123,yentel,1672,1555,1-0,Philidor Defense #2,C41,https://lichess.org/xb8244kV,240+0,Normal
zeitgeist_kaal,Exar,1706,1771,1-0,Sicilian Defense: Old Sicilian,B30,https://lichess.org/pY75WLon,60+1,Normal
yeellow,donerizo,2034,1930,0-1,Sicilian Defense,B20,https://lichess.org/Zgw457KQ,180+0,Normal
horseyhat,jschess,1739,1969,0-1,Bishop's Opening: Calabrese Countergambit,C23,https://lichess.org/2zG8P32z,300+0,Normal
mayconce,mostafa191919,2001,1728,1-0,Scandinavian Defense: Mieses-Kotroc Variation,B01,https://lichess.org/4cROvrIy,300+0,Normal
Hamyltonbpa,racingclub,1687,1693,0-1,King's Pawn Game: Macleod Attack,C20,https://lichess.org/Q8qDvJd9,720+0,Normal
chessace,Dynym,1647,1665,0-1,Sicilian Defense: Bowdler Attack,B20,https://lichess.org/4ElNCLGq,180+3,Time forfeit
brius343,MartinDevenney,1629,1842,0-1,"Pirc Defense: Classical Variation, Quiet System",B08,https://lichess.org/DfyjyIfX,300+0,Normal
fendo59,Chrisfischer,1675,1630,0-1,"French Defense: Advance Variation, Nimzowitsch System",C02,https://lichess.org/dABRLySZ,120+1,Normal
rodick,doradense,1610,1812,0-1,Queen's Pawn,A41,https://lichess.org/0DtErMH6,600+5,Normal
Alex_22,LeonardoPSG95,2035,1577,1-0,Philidor Defense,C41,https://lichess.org/JzVmdQ5f,60+0,Normal
i2hi2play,Finland,1442,1558,1-0,English Defense #2,A40,https://lichess.org/3buhWOt9,300+0,Normal
Circa82,Ushisan,1275,1790,0-1,"Sicilian Defense: Dragon Variation, Classical Variation #2",B72,https://lichess.org/WU3epEde,60+0,Time forfeit
zouhir,moacir,1651,1614,1/2-1/2,Queen's Pawn Game #2,D00,https://lichess.org/ZU3Rt2vI,60+1,Normal
Peon__mal0,DanielGonzales,1721,1841,1-0,Four Knights Game: Scotch Variation Accepted,C47,https://lichess.org/qZgR8y5f,180+0,Normal
helmutLipfert6,CtrlAltDelicious,1639,2051,0-1,Sicilian Defense: McDonnell Attack,B21,https://lichess.org/y6LcGxK1,60+0,Time forfeit
marcomar,projeto,1789,1700,0-1,Hungarian Opening,A00,https://lichess.org/Nuh7SpMo,120+8,Normal
Perfectit,ceccafili,1770,1832,0-1,Ware Opening,A00,https://lichess.org/TpcJxXze,1200+8,Normal
sieniek,Peapop,1628,1655,1-0,Philidor Defense #3,C41,https://lichess.org/qQLKta3c,300+3,Normal
paulpalacios,yorwaxed,1854,1861,1-0,Scandinavian Defense: Modern Variation #2,B01,https://lichess.org/zu4OhM8G,300+0,Normal
Xykko,rikpal,1612,1777,1-0,Pirc Defense #4,B07,https://lichess.org/hSL7g3KA,240+0,Normal
hax123,Benoitsky,1903,1857,0-1,King's Indian Defense: Accelerated Averbakh Variation,E70,https://lichess.org/xWjLpS2Z,300+0,Normal
chalomaria,rodribal,1999,1875,1-0,Queen's Gambit Refused: Marshall Defense,D06,https://lichess.org/buGUt4jj,600+0,Normal
bichopebitou,mate_amargo,1622,1664,1-0,Nimzo-Larsen Attack,A01,https://lichess.org/NSJizMgM,60+0,Time forfeit
CheckersMan,nortonattack,1805,1897,1-0,Slav Defense #2,D10,https://lichess.org/XJWT7mjU,600+0,Normal
Arsen-Shahunts,cesarmamani79,1874,1826,1-0,"Nimzowitsch Defense: Kennedy Variation, Linksspringer Variation",B00,https://lichess.org/qCat7UH8,0+1,Time forfeit
sadrazam,Krangg,1537,1436,1-0,Dutch Defense,A80,https://lichess.org/k1DVpy2v,180+0,Time forfeit
sabac,alrawy,1672,2047,0-1,Hungarian Opening: Indian Defense,A00,https://lichess.org/66rfKgn6,600+0,Normal
GameofFrowns,skituljko13,1916,1806,1-0,French Defense: Knight Variation,C00,https://lichess.org/IVkqIAnK,600+0,Time forfeit
Ignorante,Richard2,1763,1759,1-0,Queen's Gambit Refused: Austrian Defense,D06,https://lichess.org/YeGBOhqx,120+0,Normal
mikjmr26,mtnmcallister,1782,1383,1-0,Caro-Kann Defense,B10,https://lichess.org/reGfdak8,300+0,Normal
rorolatourmente,hg1015,1796,2156,0-1,Caro-Kann Defense,B10,https://lichess.org/62CT4Ftj,180+0,Normal
Aladinek,farbod1,1957,1760,1/2-1/2,Ruy Lopez: Morphy Defense,C78,https://lichess.org/NPtcSg4C,180+2,Normal
ParsIran,abdo_7oss,1649,1887,0-1,Sicilian Defense: Open #3,B32,https://lichess.org/pjv2JEls,180+0,Normal
Maradona86,georgemguitarist,1873,1805,1-0,Queen's Gambit Declined: Queen's Knight Variation,D31,https://lichess.org/Qfn1PVWE,240+0,Normal
hnabhan,yaraos,1790,1278,1-0,Petrov's Defense,C42,https://lichess.org/IfOeHMHV,-,Normal
paerstymer,MrLegilimens,1670,1629,0-1,Queen's Gambit Refused: Marshall Defense,D06,https://lichess.org/abQVelu2,60+0,Time forfeit
grasshopper,decidement,1806,2005,1-0,Hungarian Opening,A00,https://lichess.org/o1wgrv4Z,60+0,Normal
giumag,Mejentyrty,1444,1875,0-1,Queen's Pawn Game: Symmetrical Variation,D02,https://lichess.org/DCYHPEw7,300+0,Time forfeit
Aristote69,rich21,1681,1257,1-0,Russian Game: Three Knights Game,C42,https://lichess.org/ill7RXcQ,180+5,Normal
Kambalass,derBomber,1792,1635,1-0,French Defense: King's Indian Attack,C00,https://lichess.org/Zip7AgLN,300+0,Time forfeit
holosplay,kmk74,1412,1579,1/2-1/2,Nimzo-Larsen Attack,A01,https://lichess.org/BTzOw00I,600+0,Normal
ASADcz,Kastell10,1789,1737,0-1,Nimzo-Larsen Attack,A01,https://lichess.org/QzPKtSpU,120+0,Time forfeit
slobodan0808,EamonMont,1470,1843,0-1,Sicilian Defense: Bowdler Attack,B20,https://lichess.org/WWxIDqNA,300+0,Normal
Tsarukyan,Chessorama,1637,1911,0-1,French Defense: King's Indian Attack,C00,https://lichess.org/DimS2YMo,600+0,Normal
JuliusDL,LT2016,1749,1741,1-0,Horwitz Defense,A40,https://lichess.org/2EcC7aPX,60+0,Time forfeit
Enric52,honorarycitizen,1825,1967,0-1,Caro-Kann Defense,B11,https://lichess.org/4giycZw2,60+0,Normal
Gallaecia,tchang1997,1477,1519,0-1,Sicilian Defense,B20,https://lichess.org/pfodYGo2,1200+10,Normal
Fischess,ibricaaa,1937,1428,1-0,Three Knights Opening,C46,https://lichess.org/AFBoo4sM,180+0,Time forfeit
Volocuga,ioannes100,1691,1696,1-0,Sicilian Defense: Delayed Alapin,B50,https://lichess.org/MMHEHvcu,300+0,Normal
Ernestobula,diskala,1782,1716,1-0,Queen's Pawn Game: Mason Attack,D00,https://lichess.org/YqVlCedx,900+0,Normal
davud1366,Sayesomob,1447,1810,0-1,Bird Opening: Williams Gambit,A03,https://lichess.org/o81YqF9l,300+0,Time forfeit
peacenblessing,billytaylor64,1710,1567,1-0,Sicilian Defense: Staunton-Cochrane Variation,B20,https://lichess.org/ws27YnMp,360+0,Time forfeit
nightphorge,Paco67,1896,1695,1-0,Van Geet Opening,A00,https://lichess.org/ZnqXydwF,60+0,Time forfeit
Jesus33,JackBauer,1823,2112,0-1,Vienna Game: Mieses Variation,C26,https://lichess.org/atlk8LOm,300+0,Normal
Urbano,w-e-e-d,1789,1852,0-1,Rat Defense: Small Center Defense,C00,https://lichess.org/Xehi24ak,30+0,Normal
videk,newsimbol,1447,1498,0-1,Queen's Pawn Game,D00,https://lichess.org/xVxHZc6s,0+4,Time forfeit
grinch11,Philipp_Stuttgart,1869,2077,0-1,French Defense: Normal Variation,C00,https://lichess.org/MhdrA7K3,60+0,Normal
morfolideo_sacco,Sabelrat,2043,1908,0-1,"French Defense: Advance Variation, Euwe Variation",C02,https://lichess.org/RU59x04Y,300+0,Normal
maxlav,mechanized,2025,1665,1-0,"Italian Game: Evans Gambit, Tartakower Attack",C52,https://lichess.org/oxIfVQ6c,180+0,Normal
samuelhaupt3,packattack737,2102,1830,0-1,King's Indian Defense: Orthodox Variation,E91,https://lichess.org/xvoFUgJJ,60+0,Time forfeit
Luis1973,rotehund,1793,1778,0-1,French Defense #2,C00,https://lichess.org/OSNr43uV,180+0,Time forfeit
Nedjo-Master,Turukmakkto,1720,1975,1-0,Scotch Game,C45,https://lichess.org/pEbQC2Ym,60+0,Normal
maris88,Foutleerwerk,1846,1890,1-0,St. George Defense,B00,https://lichess.org/cIocHs1F,240+2,Normal
Bupi99,mikelimtm,1420,1656,0-1,French Defense: Knight Variation,C00,https://lichess.org/nCFPOAxH,1800+0,Normal
RussianMaverik,arequipatomas,1361,1522,1-0,King's Pawn Game: Damiano Defense,C40,https://lichess.org/IycRyi4f,180+0,Normal
IsraelAlcaraz,kartoshka69,1660,1777,0-1,Center Game: Normal Variation,C22,https://lichess.org/o54WeHzm,180+0,Time forfeit
albybobby,bezveze,1688,1792,0-1,Scandinavian Defense,B01,https://lichess.org/hfL1GfRa,60+0,Time forfeit
shuntandromed1,fishpatz,1998,1676,0-1,French Defense: Normal Variation,C00,https://lichess.org/iYf8kWlT,60+0,Normal
Tregelles,IICUXOIIAT,1545,1682,1-0,Sicilian Defense: Keres Variation,B20,https://lichess.org/MVJwAOqC,120+2,Normal
sciguy,ehsan699,1401,1672,0-1,Queen's Pawn Game,D00,https://lichess.org/VY6vDofo,180+0,Time forfeit
Stupe11,Thelugalz,1764,2015,0-1,"Sicilian Defense: Accelerated Dragon, Modern Variation",B34,https://lichess.org/1XKRz5oN,60+0,Time forfeit
Grota,mies,1576,1550,0-1,Bishop's Opening: Berlin Defense,C24,https://lichess.org/N4dIYg9a,1200+5,Normal
inkt2002,rautor,1495,1525,0-1,Philidor Defense #3,C41,https://lichess.org/mBddCwBt,0+4,Normal
Ben034,NikB,1893,1834,0-1,English Opening: Agincourt Defense,A13,https://lichess.org/f2hyFqXe,120+0,Time forfeit
keresmatic,Avatarhood,1691,1825,0-1,"King's Gambit Declined, Queen's Knight Defense",C30,https://lichess.org/lSZ6spix,180+0,Time forfeit
Marian3,superchango99,1425,1491,0-1,Four Knights Game: Spanish Variation,C48,https://lichess.org/RcCaN4IE,300+0,Normal
Brancho,katanca,1701,1690,1-0,French Defense #2,C00,https://lichess.org/EGHBGLdT,300+0,Normal
Kintsugi,yann124,1675,1645,1-0,Slav Defense: Modern Line,D11,https://lichess.org/s60ief4A,180+0,Normal
ricky14,stevieray,1842,1878,0-1,Slav Defense: Exchange Variation,D10,https://lichess.org/oWSJLban,600+0,Normal
KZC,Sviat0,1536,1594,1-0,Sicilian Defense,B20,https://lichess.org/giFCV6yg,300+3,Normal
IndiGroove,Ivorybags,1825,1891,1-0,Philidor Defense: Exchange Variation #2,C41,https://lichess.org/GEsChALu,900+3,Normal
lastgioaspe,serkanatis,1950,1913,0-1,Rat Defense: Small Center Defense,C00,https://lichess.org/OOVoxtNP,180+2,Normal
leoauber,MaxSherwin,1556,1435,1-0,Sicilian Defense: Bowdler Attack,B20,https://lichess.org/DxNq3lOe,180+3,Normal
sobh,inge_7000,1900,1946,0-1,Hungarian Opening: Slav Formation,A00,https://lichess.org/CXFY6Pl2,30+0,Time forfeit
castles,windycitycg,1825,1568,1-0,Semi-Slav Defense: Accelerated Move Order,D31,https://lichess.org/mpay0jhs,60+0,Time forfeit
Iohonon,patatero,1904,1349,1-0,"Queen's Gambit Refused: Chigorin Defense, Janowski Variation",D07,https://lichess.org/MZjwvM7R,300+0,Time forfeit
andopp,Knn1215,1673,1481,1-0,Scandinavian Defense: Mieses-Kotroc Variation,B01,https://lichess.org/EdRw8dix,60+0,Time forfeit
Leonidiv,mkoga,1836,1574,1-0,Caro-Kann Defense: Exchange Variation,B13,https://lichess.org/SKh9z08E,300+0,Time forfeit
gravihouse,zombiehorse,1944,1746,1-0,Englund Gambit Complex Declined,A40,https://lichess.org/Q7em3gYc,30+0,Time forfeit
dpedro,Jgor,1835,1736,0-1,Giuoco Piano,C50,https://lichess.org/G3w7YWDK,300+8,Normal
strongesttt,panitta,2006,1957,0-1,"Queen's Gambit Refused: Chigorin Defense, Main Line",D07,https://lichess.org/6gicRPFp,180+0,Time forfeit
bb8,guantebla,1918,1944,0-1,Mieses Opening,A00,https://lichess.org/HOdF5B5C,0+1,Normal
dupinozka,Jbramel,1332,1519,0-1,Sicilian Defense: McDonnell Attack,B21,https://lichess.org/UAjssbB7,45+3,Time forfeit
IsolatedPun-Youtube,Zijiakee,1939,1993,0-1,French Defense: Knight Variation,C00,https://lichess.org/efZBFGGZ,180+0,Normal
elodotis,TARGUS2015,1891,1755,1-0,Alekhine Defense,B03,https://lichess.org/lv9BeKve,300+0,Time forfeit
pawncount,hyungnam,1736,1676,1-0,Ruy Lopez: Cozio Defense,C60,https://lichess.org/jyxbkfqP,120+0,Normal
Siul,herbalife,1642,1232,1-0,Sicilian Defense: Jalalabad Variation,B27,https://lichess.org/yRRG2R7B,900+10,Normal
alanogier,laslonadjlacika,1843,1688,1-0,Modern Defense,A40,https://lichess.org/lNeRMmIQ,720+10,Normal
andrescg_ox2,GUIME,1539,1426,1-0,Horwitz Defense,A40,https://lichess.org/FgQoL6EL,600+0,Normal
graho,kjf,1728,1848,0-1,Sicilian Defense: French Variation,B40,https://lichess.org/jGXnI9qf,600+0,Normal
geewhiz,corey561,1513,1749,0-1,Caro-Kann Defense: Two Knights Attack,B10,https://lichess.org/CaTtsm2K,300+0,Time forfeit
Giacomix,dasuboot,1952,1921,1-0,Bird Opening,A02,https://lichess.org/ixCsHvos,300+0,Normal
Rickveg,Fastnovaster1,1493,1408,1-0,Queen's Pawn Game,D00,https://lichess.org/vHicFIkX,600+5,Normal
vladrodivojac,patika,1870,1671,1-0,Philidor Defense #3,C41,https://lichess.org/0XVxLlms,180+0,Normal
lastminute,mzperx60,1791,1888,0-1,Pirc Defense #4,B07,https://lichess.org/dHpyJydd,180+0,Normal
taborluna,Paulic,1632,1457,1-0,French Defense: Advance Variation #3,C02,https://lichess.org/86DbxDVW,900+3,Normal
x_dmb,Antiputin,1633,1856,0-1,French Defense: Steinitz Attack,C00,https://lichess.org/mrTarLbT,180+0,Normal
Tramurr,ThalesVictor,1690,1730,1-0,Sicilian Defense: Bowdler Attack,B20,https://lichess.org/y3htGtTX,900+0,Normal
Douk,cristipb,2018,1263,1-0,Queen's Pawn Game: Mason Attack,D00,https://lichess.org/BFW8ZuRu,300+8,Normal
cucullus,ultimathule79,1522,1596,0-1,Hungarian Opening: Sicilian Invitation,A00,https://lichess.org/HpyLRXnv,900+15,Normal
bucephalus,platypusdavid,1846,1352,1-0,English Opening: King's English Variation,A20,https://lichess.org/F34J1QFZ,300+0,Normal
gaoutte,JonnesMatao,1576,1778,1-0,Alekhine Defense: Scandinavian Variation,B02,https://lichess.org/lsLrwOmy,180+0,Time forfeit
milanbelobrk,mosssss,1964,1846,1-0,Van't Kruijs Opening,A00,https://lichess.org/Icx3UDFq,60+0,Time forfeit
currumbrucu,antalyayolcusu,1926,1764,0-1,English Opening: Agincourt Defense,A13,https://lichess.org/n75aIYrp,300+0,Time forfeit
p0sc0,bon-jovi,1836,1821,1/2-1/2,Modern Defense: Averbakh Variation,A42,https://lichess.org/TOQ8hfzp,300+0,Normal
luislo,fchelia,1704,1770,0-1,Sicilian Defense: Old Sicilian,B30,https://lichess.org/RaMRkhwG,180+1,Normal
shasad,zz15,1722,1525,1-0,Nimzo-Larsen Attack: Modern Variation #2,A01,https://lichess.org/y4ukYapT,180+0,Normal
chessisart,ljubisapanic81,1808,1944,1/2-1/2,"Sicilian Defense: Lasker-Pelikan Variation, Schlechter Variation",B33,https://lichess.org/JgaZqb16,480+0,Normal
Amantis,ferrisx,1941,1968,1-0,Sicilian Defense: Nyezhmetdinov-Rossolimo Attack,B30,https://lichess.org/32hxs8zT,60+0,Time forfeit
Wezta,RezilVezir,1852,1853,0-1,Caro-Kann Defense,B10,https://lichess.org/AGHjgiR2,60+0,Time forfeit
julianrey,juantito2001,1817,1770,1-0,Queen's Pawn Game: Chigorin Variation,D01,https://lichess.org/E8wKj2nn,1200+0,Normal
milutovac,ulysse63,1594,1426,0-1,French Defense: Knight Variation,C00,https://lichess.org/1L4PF1hK,180+0,Normal
tolima307,dawsofield,1779,1655,1-0,"Italian Game: Two Knights Defense, Fried Liver Attack",C57,https://lichess.org/m3khvnbK,600+0,Normal
khalilamomen,JESUSKING,1632,1840,0-1,Sicilian Defense: Bowdler Attack,B20,https://lichess.org/pjMArDKm,600+0,Normal
Wutendes_Heer,Miza82,1878,1772,1-0,Polish Opening,A00,https://lichess.org/uKKUHnOG,300+0,Normal
Talriva,Rafaelsigma,1969,1983,1-0,Polish Opening: Czech Defense,A00,https://lichess.org/X25iWUWF,180+2,Normal
SexualMind,Pellwurm,1942,1908,0-1,French Defense: Steiner Variation,C00,https://lichess.org/2dcopsk0,180+0,Time forfeit
Terrificying,grolps,2098,1534,1-0,"Vienna Game: Vienna Gambit, Steinitz Gambit, Knight Variation",C25,https://lichess.org/zR6iNkZR,60+0,Normal
Cornu,greendog,1414,1433,1-0,Sicilian Defense: Bowdler Attack,B20,https://lichess.org/a6PxeUUZ,300+0,Normal
eyupcan,Sasha01,1627,1652,0-1,King's Pawn Game,C20,https://lichess.org/bFf1pzgx,1800+0,Normal
SUTHEY2,will-resign-4-beer,1691,1735,0-1,Pirc Defense #4,B07,https://lichess.org/bXUNsO53,60+0,Time forfeit
thiaguinho,drepoferreira,1796,1682,1-0,Queen's Gambit Refused: Marshall Defense,D06,https://lichess.org/9UbkRAOu,300+0,Time forfeit
against-my-self,jupeq,1930,2043,1-0,Queen's Pawn Game: Zukertort Variation,D02,https://lichess.org/7Nt4sXd6,60+0,Normal
NightM,libi77,1835,1818,1-0,Ruy Lopez: Closed,C88,https://lichess.org/SV3TrFYn,120+1,Normal
renault18,Duck79,2042,1590,1-0,Bishop's Opening,C23,https://lichess.org/ojYgByyH,600+0,Normal
hithamony,roller_yalta,1694,1654,1-0,Sicilian Defense,B50,https://lichess.org/XB7a7qVD,180+0,Normal
blunder_maker,uhoh123,1678,1636,1-0,Old Benoni Defense,A43,https://lichess.org/jZVF8dYk,180+0,Normal
ZooTV,Cullarvega,1397,1685,0-1,Sicilian Defense: Bowdler Attack,B20,https://lichess.org/LJc8LV3v,600+0,Normal
robadamas,rferrer,1686,1557,1-0,Slav Defense #2,D10,https://lichess.org/op9TRpSb,420+0,Normal
filipfico,TACHI88,1717,1465,1-0,Queen's Pawn Game: Levitsky Attack,D00,https://lichess.org/nMNQSiiI,360+0,Normal
Triceratops_2007,Zhgilmev,1580,1490,0-1,French Defense: Normal Variation,C00,https://lichess.org/lgjgTVW8,180+2,Normal
Marciobastos,RoronoaZoro26,1479,1537,1-0,Caro-Kann Defense,B10,https://lichess.org/eBV1ISoF,300+0,Normal
MannyTheKnight,galita,1604,1520,1-0,French Defense #2,C00,https://lichess.org/l9xBNnSm,60+1,Time forfeit
BiggKipp,Vmax,1603,1581,1-0,Queen's Pawn Game: Krause Variation,D02,https://lichess.org/X5p7OKuH,180+0,Normal
scarlo,sharin,1424,1482,0-1,Sicilian Defense: O'Kelly Variation,B28,https://lichess.org/YVt3bFKl,180+2,Normal
Pettenchess,Snowden,1470,1617,0-1,Nimzowitsch Defense,B00,https://lichess.org/wIJL0xxa,480+0,Normal
vasja2,Hemericus,1933,1971,1/2-1/2,Philidor Defense #2,C41,https://lichess.org/Dh1tFirR,60+0,Time forfeit
lobyno,PacMan1,1838,1673,0-1,"Sicilian Defense: Lasker-Pelikan Variation, Schlechter Variation",B33,https://lichess.org/2nAH7eRs,300+0,Normal
lesia,Dinnei,1916,1636,1-0,Sicilian Defense: Loewenthal Variation,B32,https://lichess.org/YeMPK5yP,180+2,Time forfeit
Josemar,dappertutto,1807,1745,1-0,French Defense: Horwitz Attack,C00,https://lichess.org/cmrXjnVZ,300+0,Normal
t100022,irondragon,1675,1496,1-0,"Nimzowitsch Defense, Declined Variation",B00,https://lichess.org/urnp6QCj,300+3,Normal
tranzas,philbill,1748,1644,1-0,Pirc Defense #4,B07,https://lichess.org/kWKX0DJN,300+0,Normal
navash,mgtevt,1588,1657,1-0,Sicilian Defense,B20,https://lichess.org/9NEfpktK,180+0,Normal
denti,Jomagi,1728,1287,1-0,Scotch Game,C45,https://lichess.org/sNFSTwox,300+0,Normal
eugapop,MeteMates,1884,1833,1-0,Vienna Game,C27,https://lichess.org/zLTfj8H2,300+2,Normal
Natali6969,toskani,1844,1735,1-0,Russian Game: Three Knights Game,C42,https://lichess.org/mEjri1Xh,600+0,Normal
Syas,cajohnm,1676,1653,0-1,"Italian Game: Giuoco Pianissimo, Italian Four Knights Variation",C50,https://lichess.org/HlLEhxpg,300+10,Normal
notrobot,coronzon,1864,1730,1-0,Queen's Gambit Declined: Queen's Knight Variation,D31,https://lichess.org/ohftokR3,60+0,Time forfeit
sauvignon,chancy,1724,1751,0-1,Scandinavian Defense: Panov Transfer,B01,https://lichess.org/jJtVT9GZ,60+2,Normal
Brunomig,BlueSmoke,1489,1572,0-1,"Vienna Game: Stanley Variation, Three Knights Variation",C28,https://lichess.org/ignTjrq6,600+0,Normal
choty,theWeakForce,1530,1637,0-1,"French Defense: Advance Variation, Nimzowitsch System",C02,https://lichess.org/iiLxUFTo,900+5,Normal
elmarbaku,jpagroup,1631,1541,1-0,French Defense: Knight Variation,C00,https://lichess.org/9vPvu5c3,120+1,Normal
nobleBee,blackbamba,1791,1818,1-0,Sicilian Defense: Bowdler Attack,B20,https://lichess.org/oQuboV5G,300+0,Time forfeit
anscariusbarcino,The_Ingenious,1491,1683,0-1,French Defense #2,C00,https://lichess.org/3yQEyThc,60+0,Normal
mao64,karun0109,1849,1798,0-1,Queen's Pawn Game,D00,https://lichess.org/Qo7oHwr2,180+0,Normal
julian21olarte,rahem,1655,1628,1-0,Russian Game: Millennium Attack,C42,https://lichess.org/whyfGq2V,900+0,Normal
Berggeist,Den-Den-2013,1860,1675,0-1,Three Knights Opening,C46,https://lichess.org/cFvyO0lI,240+0,Time forfeit
teaandtoast,achimari,1483,1528,1-0,Modern Defense,A40,https://lichess.org/8OljsvoX,0+10,Time forfeit
karalyte,Mijo30,1491,1352,1-0,Queen's Gambit Accepted: Old Variation,D20,https://lichess.org/r7tEMGBR,120+0,Normal
mcbublick,zuthanatos,1629,1400,1-0,Sicilian Defense: Bowdler Attack,B20,https://lichess.org/qn7zuwKs,600+0,Time forfeit
kvc123,kbbx,1588,1529,0-1,Modern Defense,B06,https://lichess.org/SWcAy602,300+0,Normal
ves,mm2013marko,1758,1557,1-0,Queen's Gambit Declined,D30,https://lichess.org/L6RUI3XZ,60+0,Normal
FilthyBishop,IaGueTe,1856,1958,1-0,Queen's Gambit Declined: Orthodox Defense,D60,https://lichess.org/vFDI0jM6,600+15,Normal
chironik,ruka5,1478,1761,0-1,Old Benoni Defense,A43,https://lichess.org/AaylMahU,30+1,Normal
chessbona,artsys,1899,1895,0-1,Sicilian Defense: McDonnell Attack,B21,https://lichess.org/Yg8UgauW,180+0,Normal
aexl,verbie3,1812,1784,0-1,Caro-Kann Defense: Classical Variation,B18,https://lichess.org/JDEQQml8,300+0,Normal
elvin009,Timao,1786,1969,0-1,French Defense: Knight Variation,C00,https://lichess.org/cH7KNtgN,480+0,Time forfeit
AnonimoRD,chess_killer,1631,1986,0-1,Bishop's Opening: Berlin Defense,C24,https://lichess.org/f7LUiIrF,300+0,Normal
sgmsg,czento53,1681,2075,0-1,Bird Opening: Dutch Variation,A03,https://lichess.org/qkXXCkAn,60+0,Time forfeit
cotale,Xtravia9,1492,1893,0-1,King's Pawn Game: Leonardis Variation,C20,https://lichess.org/psgCFxGM,300+3,Normal
velnael,D21,1722,1756,1-0,Hungarian Opening,A00,https://lichess.org/tzgY2XcD,180+0,Normal
jacktheripper75,Sergey_Rostov,1596,1589,0-1,Nimzo-Larsen Attack: Modern Variation #4,A01,https://lichess.org/JCB086Wj,300+0,Normal
Leoliterario,CHESSMS,1568,1502,1-0,Old Indian Defense,A53,https://lichess.org/VmVxXkKP,480+5,Normal
lukis12,ivancapote,1870,1742,1-0,Sicilian Defense: Loewenthal Variation,B32,https://lichess.org/hpYNCVFI,480+0,Normal
luitek7,PascalBrutal,1961,1802,0-1,Sicilian Defense: Snyder Variation,B20,https://lichess.org/vO11NDxN,180+0,Time forfeit
V7V7V7,cirrus105,1729,1734,1-0,Russian Game: Modern Attack,C43,https://lichess.org/GC0AuzOb,300+0,Normal
SNV,kamspol,1807,1542,1-0,Indian Game: London System,A46,https://lichess.org/yoORaHfu,30+0,Normal
GuerreroMexica,kora,1495,1376,0-1,"King's Gambit, Falkbeer Countergambit, Staunton Line",C31,https://lichess.org/MQSfR4Rw,120+0,Normal
westicide,cm2,1472,1511,1-0,Center Game #2,C21,https://lichess.org/R6x3zdgR,480+5,Normal
Jordisa,Kaspachov,1837,1852,1-0,"Ruy Lopez: Classical Variation, Central Variation",C64,https://lichess.org/PjsDIsIM,360+10,Normal
dctrip13,Thor401025,1798,1697,1-0,Sicilian Defense: Buecker Variation,B27,https://lichess.org/EQRIZqEJ,1800+0,Normal
cefisidoro,Aseric,1606,1330,1-0,Scotch Game,C44,https://lichess.org/Hl9uINB2,180+5,Normal
philidov,hichamsbitri,1496,1304,1-0,Ruy Lopez: Bird Variation,C61,https://lichess.org/HWKdZcXX,300+0,Normal
Henry-Joe,mad_giraffe,1736,1788,0-1,Rat Defense: Small Center Defense,C00,https://lichess.org/Vb5tZi8A,600+0,Normal
Dier,bhopal66,1831,1621,1-0,Torre Attack #2,A46,https://lichess.org/mTCusFcI,300+0,Normal
HarpoMarx,Ham0931,1827,1647,1-0,"French Defense: Advance Variation, Paulsen Attack",C02,https://lichess.org/5SizP3oG,600+0,Time forfeit
badasswarrior1990,khanwer,1650,2050,0-1,French Defense: Advance Variation #2,C02,https://lichess.org/vVxD1iWj,600+0,Normal
eloelo320,levagabon_du92,1552,1457,0-1,Queen's Pawn Game #2,D00,https://lichess.org/1ChxIARc,300+0,Normal
konstantink,SimonTolomeo,1561,1643,0-1,Indian Game: West Indian Defense,E61,https://lichess.org/RCfp5JjP,240+4,Normal
Master_Chess_Konny,micuenta,1587,1347,1-0,English Opening: Agincourt Defense #3,A13,https://lichess.org/Lxv45fxv,10800+0,Normal
Fi-scher,Little_Claus,1550,1585,1-0,Ruy Lopez: Berlin Defense #2,C65,https://lichess.org/mauajup0,780+0,Normal
Permutater,MarkoKrunic,1684,1779,1-0,Van't Kruijs Opening,A00,https://lichess.org/kPIiGzsi,540+20,Normal
dnl,exxsa,1591,1529,1-0,"King's Gambit Declined, Queen's Knight Defense",C30,https://lichess.org/Tm6Xq2K3,180+3,Time forfeit
debelibokac,agusbon3212,1600,1626,1-0,"King's Gambit Declined, Queen's Knight Defense",C30,https://lichess.org/S3NsGe4y,300+10,Normal
GuirecTourment,f4-e5,1500,1826,0-1,Indian Game,A45,https://lichess.org/fdW96WjB,300+0,Normal
Marinko27,ElChino17,1776,1737,0-1,Sicilian Defense: Smith-Morra Gambit #2,B21,https://lichess.org/UnoueOjK,360+0,Time forfeit
robobaggins,dastrian,1576,1687,0-1,"Sicilian Defense: Modern Variations, Tartakower",B53,https://lichess.org/AxKCMDQ5,30+3,Normal
Skidoodle,edia10,1521,1336,1-0,Mikenas Defense,A40,https://lichess.org/u4EJAnES,180+0,Time forfeit
anax_makis,kra22,2184,1708,1-0,Sicilian Defense: Old Sicilian,B30,https://lichess.org/lM8X8PBI,600+0,Time forfeit
LechuckDegoulash,Zenga,1868,1817,1-0,Sicilian Defense: Closed Variation,B23,https://lichess.org/CzCHuwKc,600+0,Normal
rafael59,danilu,1641,1610,0-1,Queen's Pawn Game: Franco-Sicilian Defense,C00,https://lichess.org/044BbBex,300+0,Normal
ghelas74,dror13,1604,1410,1-0,Scandinavian Defense: Mieses-Kotroc Variation,B01,https://lichess.org/Hr6QwJSs,900+5,Normal
aila,HicSuntLeones555,1818,1953,1-0,Queen's Pawn Game: Zukertort Variation,D02,https://lichess.org/MsPBNzlj,120+1,Normal
